[
  {
    "badgeId": "PACIO-BDG-2025-0001",
    "eventId": "2025-01-hl7-connectathon",
    "status": "Active",
    "recipientDisplayName": "Patient Centric Solutions",
    "recipientType": "Organization",
    "companyName": "Patient Centric Solutions",
    "badgeCategory": "FHIR Implementer",
    "eventName": "HL7 Connectathon",
    "eventDateRange": "January 2025",
    "keyContributors": "Nancy Lush",
    "verificationUrl": "https://pacioproject.org/verification/?id=PACIO-BDG-2025-0001",
    "lastUpdated": "2026-07-26"
  },
  {
    "badgeId": "PACIO-BDG-2025-0002",
    "eventId": "2025-07-cms-connectathon",
    "status": "Active",
    "recipientDisplayName": "Patient Centric Solutions",
    "recipientType": "Organization",
    "companyName": "Patient Centric Solutions",
    "badgeCategory": "FHIR Implementer",
    "eventName": "CMS Connectathon",
    "eventDateRange": "2025-07-01",
    "verificationUrl": "https://pacioproject.org/verification/?id=PACIO-BDG-2025-0002",
    "lastUpdated": "2026-08-05"
  },
  {
    "badgeId": "PACIO-BDG-2026-0001",
    "eventId": "2026-07-cms-connectathon",
    "status": "Active",
    "recipientDisplayName": "Matrix Care",
    "recipientType": "Organization",
    "companyName": "Matrix Care",
    "badgeCategory": "FHIR Implementer",
    "eventName": "CMS Connectathon",
    "eventDateRange": "July 2026",
    "verificationUrl": "https://pacioproject.org/verification/?id=PACIO-BDG-2026-0001",
    "lastUpdated": "2026-08-05"
  },
  {
    "badgeId": "PACIO-BDG-2026-0002",
    "eventId": "2026-07-cms-connectathon",
    "status": "Active",
    "recipientDisplayName": "NCQA",
    "recipientType": "Organization",
    "companyName": "NCQA",
    "badgeCategory": "FHIR Implementer",
    "eventName": "CMS Connectathon",
    "eventDateRange": "July 2026",
    "verificationUrl": "https://pacioproject.org/verification/?id=PACIO-BDG-2026-0002",
    "lastUpdated": "2026-08-05"
  },
  {
    "badgeId": "PACIO-BDG-2026-0003",
    "eventId": "2026-07-cms-connectathon",
    "status": "Active",
    "recipientDisplayName": "Global Alliant",
    "recipientType": "Organization",
    "companyName": "Global Alliant",
    "badgeCategory": "FHIR Implementer",
    "eventName": "CMS Connectathon",
    "eventDateRange": "July 2026",
    "verificationUrl": "https://pacioproject.org/verification/?id=PACIO-BDG-2026-0003",
    "lastUpdated": "2026-08-05"
  },
  {
    "badgeId": "PACIO-BDG-2026-0004",
    "eventId": "2026-07-cms-connectathon",
    "status": "Active",
    "recipientDisplayName": "Orbital Health Systems",
    "recipientType": "Organization",
    "companyName": "Orbital Health Systems",
    "badgeCategory": "FHIR Implementer",
    "eventName": "CMS Connectathon",
    "eventDateRange": "July 2026",
    "verificationUrl": "https://pacioproject.org/verification/?id=PACIO-BDG-2026-0004",
    "lastUpdated": "2026-08-05"
  },
  {
    "badgeId": "PACIO-BDG-2026-0005",
    "eventId": "2026-07-cms-connectathon",
    "status": "Active",
    "recipientDisplayName": "Washington DOH",
    "recipientType": "Organization",
    "companyName": "Washington State DOH",
    "badgeCategory": "FHIR Implementer",
    "eventName": "CMS Connectathon",
    "eventDateRange": "July 2026",
    "verificationUrl": "https://pacioproject.org/verification/?id=PACIO-BDG-2026-0005",
    "lastUpdated": "2026-08-05"
  },
  {
    "badgeId": "PACIO-BDG-2026-0006",
    "eventId": "2026-07-cms-connectathon",
    "status": "Active",
    "recipientDisplayName": "MyDirectives",
    "recipientType": "Organization",
    "companyName": "MyDirectives, Inc.",
    "badgeCategory": "FHIR Implementer",
    "eventName": "CMS Connectathon",
    "eventDateRange": "July 2026",
    "keyContributors": "Maria Moen and Lisa Nelson",
    "verificationUrl": "https://pacioproject.org/verification/?id=PACIO-BDG-2026-0006",
    "lastUpdated": "2026-08-05"
  }
]
